{"alignment_id":null,"alignment_status":"UNVERIFIED","cameras":[{"camera_id":"cam_01","export_first_observed_source_message_ns":"200","export_last_observed_source_message_ns":"300","exported_frame_count":2,"exported_packet_count":2,"height":1300,"input_message_count":3,"keyframe_count":1,"leading_drops":{"count":1,"first_source_ns":"100","last_source_ns":"100","reason_code":"BEFORE_FIRST_DECODABLE_KEYFRAME"},"media_time_mapping":{"first_pts":0,"last_duration":100,"last_pts":100,"max_rounding_error_ns":"0","rounding":"HALF_EVEN","tail_duration_policy":"MEDIAN_POSITIVE_INTERVAL","time_base_denominator":1000000000,"time_base_numerator":1,"zero_source_ns":"200"},"source":{"channel_id":1,"codec":"h264","schema_name":"foxglove.CompressedImage","topic":"/camera/1"},"source_first_observed_message_ns":"100","source_last_observed_message_ns":"300","timestamp_sidecar_artifact":{"bytes":822,"media_type":"application/x-ndjson","row_count":2,"sha256":"bc38dc7ce02766eb602145e2a1d9d2e91aab9ae2689700b7767800dfb46f6f13","uri":"robata-local://timestamp-map/cam_01.timestamps.jsonl"},"trailing_drops":{"count":0,"first_source_ns":null,"last_source_ns":null,"reason_code":"NONE"},"video_artifact":{"bytes":10,"media_type":"video/mp4","sha256":"19b6d9a4cc45ba78118a1553808ed49b00cedf1644688213952c058943f1e740","uri":"robata-local://video/cam_01.mp4"},"width":1600},{"camera_id":"cam_02","export_first_observed_source_message_ns":"200","export_last_observed_source_message_ns":"300","exported_frame_count":2,"exported_packet_count":2,"height":1300,"input_message_count":3,"keyframe_count":1,"leading_drops":{"count":1,"first_source_ns":"100","last_source_ns":"100","reason_code":"BEFORE_FIRST_DECODABLE_KEYFRAME"},"media_time_mapping":{"first_pts":0,"last_duration":100,"last_pts":100,"max_rounding_error_ns":"0","rounding":"HALF_EVEN","tail_duration_policy":"MEDIAN_POSITIVE_INTERVAL","time_base_denominator":1000000000,"time_base_numerator":1,"zero_source_ns":"200"},"source":{"channel_id":2,"codec":"h264","schema_name":"foxglove.CompressedImage","topic":"/camera/2"},"source_first_observed_message_ns":"100","source_last_observed_message_ns":"300","timestamp_sidecar_artifact":{"bytes":822,"media_type":"application/x-ndjson","row_count":2,"sha256":"2407b89d10a7e07555b3cedcd5d97383e1b9ebeeb48178600f27fe2d0f3e6927","uri":"robata-local://timestamp-map/cam_02.timestamps.jsonl"},"trailing_drops":{"count":0,"first_source_ns":null,"last_source_ns":null,"reason_code":"NONE"},"video_artifact":{"bytes":10,"media_type":"video/mp4","sha256":"8c7a37ce617fcee133346ba106afe7e52dad5ffd5c8bbce26a185139d0a8e417","uri":"robata-local://video/cam_02.mp4"},"width":1600},{"camera_id":"cam_03","export_first_observed_source_message_ns":"200","export_last_observed_source_message_ns":"300","exported_frame_count":2,"exported_packet_count":2,"height":1300,"input_message_count":3,"keyframe_count":1,"leading_drops":{"count":1,"first_source_ns":"100","last_source_ns":"100","reason_code":"BEFORE_FIRST_DECODABLE_KEYFRAME"},"media_time_mapping":{"first_pts":0,"last_duration":100,"last_pts":100,"max_rounding_error_ns":"0","rounding":"HALF_EVEN","tail_duration_policy":"MEDIAN_POSITIVE_INTERVAL","time_base_denominator":1000000000,"time_base_numerator":1,"zero_source_ns":"200"},"source":{"channel_id":3,"codec":"h264","schema_name":"foxglove.CompressedImage","topic":"/camera/3"},"source_first_observed_message_ns":"100","source_last_observed_message_ns":"300","timestamp_sidecar_artifact":{"bytes":822,"media_type":"application/x-ndjson","row_count":2,"sha256":"f8381886460c01aaacd0811c3119ab9621ba855f6bdf05e36c055eb00dccf7d7","uri":"robata-local://timestamp-map/cam_03.timestamps.jsonl"},"trailing_drops":{"count":0,"first_source_ns":null,"last_source_ns":null,"reason_code":"NONE"},"video_artifact":{"bytes":10,"media_type":"video/mp4","sha256":"e7a68c3f5565c3a40067cdccff316a0664d7ef1dc985effa8f0d9158191909b5","uri":"robata-local://video/cam_03.mp4"},"width":1600},{"camera_id":"cam_04","export_first_observed_source_message_ns":"200","export_last_observed_source_message_ns":"300","exported_frame_count":2,"exported_packet_count":2,"height":1300,"input_message_count":3,"keyframe_count":1,"leading_drops":{"count":1,"first_source_ns":"100","last_source_ns":"100","reason_code":"BEFORE_FIRST_DECODABLE_KEYFRAME"},"media_time_mapping":{"first_pts":0,"last_duration":100,"last_pts":100,"max_rounding_error_ns":"0","rounding":"HALF_EVEN","tail_duration_policy":"MEDIAN_POSITIVE_INTERVAL","time_base_denominator":1000000000,"time_base_numerator":1,"zero_source_ns":"200"},"source":{"channel_id":4,"codec":"h264","schema_name":"foxglove.CompressedImage","topic":"/camera/4"},"source_first_observed_message_ns":"100","source_last_observed_message_ns":"300","timestamp_sidecar_artifact":{"bytes":822,"media_type":"application/x-ndjson","row_count":2,"sha256":"f5fbaa920494107def1cec26f555a1d4497bbea3b92a92cfaf52e44ed532853e","uri":"robata-local://timestamp-map/cam_04.timestamps.jsonl"},"trailing_drops":{"count":0,"first_source_ns":null,"last_source_ns":null,"reason_code":"NONE"},"video_artifact":{"bytes":10,"media_type":"video/mp4","sha256":"97548c7e35ecc899b5bb941644c8520012f2244f86e8d94a3e446256e81a214d","uri":"robata-local://video/cam_04.mp4"},"width":1600},{"camera_id":"cam_05","export_first_observed_source_message_ns":"200","export_last_observed_source_message_ns":"300","exported_frame_count":2,"exported_packet_count":2,"height":1300,"input_message_count":3,"keyframe_count":1,"leading_drops":{"count":1,"first_source_ns":"100","last_source_ns":"100","reason_code":"BEFORE_FIRST_DECODABLE_KEYFRAME"},"media_time_mapping":{"first_pts":0,"last_duration":100,"last_pts":100,"max_rounding_error_ns":"0","rounding":"HALF_EVEN","tail_duration_policy":"MEDIAN_POSITIVE_INTERVAL","time_base_denominator":1000000000,"time_base_numerator":1,"zero_source_ns":"200"},"source":{"channel_id":5,"codec":"h264","schema_name":"foxglove.CompressedImage","topic":"/camera/5"},"source_first_observed_message_ns":"100","source_last_observed_message_ns":"300","timestamp_sidecar_artifact":{"bytes":822,"media_type":"application/x-ndjson","row_count":2,"sha256":"9831fbca52d7ceaf61bb6c4b4bf73db9f75711c400ccaa9d414c880abbb35b85","uri":"robata-local://timestamp-map/cam_05.timestamps.jsonl"},"trailing_drops":{"count":0,"first_source_ns":null,"last_source_ns":null,"reason_code":"NONE"},"video_artifact":{"bytes":10,"media_type":"video/mp4","sha256":"313318a74529b8da36a91637e2a74b0e905aa0fdf3e7bcc96807754d8ed4b179","uri":"robata-local://video/cam_05.mp4"},"width":1600},{"camera_id":"cam_06","export_first_observed_source_message_ns":"200","export_last_observed_source_message_ns":"300","exported_frame_count":2,"exported_packet_count":2,"height":1300,"input_message_count":3,"keyframe_count":1,"leading_drops":{"count":1,"first_source_ns":"100","last_source_ns":"100","reason_code":"BEFORE_FIRST_DECODABLE_KEYFRAME"},"media_time_mapping":{"first_pts":0,"last_duration":100,"last_pts":100,"max_rounding_error_ns":"0","rounding":"HALF_EVEN","tail_duration_policy":"MEDIAN_POSITIVE_INTERVAL","time_base_denominator":1000000000,"time_base_numerator":1,"zero_source_ns":"200"},"source":{"channel_id":6,"codec":"h264","schema_name":"foxglove.CompressedImage","topic":"/camera/6"},"source_first_observed_message_ns":"100","source_last_observed_message_ns":"300","timestamp_sidecar_artifact":{"bytes":822,"media_type":"application/x-ndjson","row_count":2,"sha256":"fa9ad67ab391c337fc06d7c134d8a4c2c50eb38991aa26a53a54c09a007b0a11","uri":"robata-local://timestamp-map/cam_06.timestamps.jsonl"},"trailing_drops":{"count":0,"first_source_ns":null,"last_source_ns":null,"reason_code":"NONE"},"video_artifact":{"bytes":10,"media_type":"video/mp4","sha256":"bdfe8de57b5bb16e527182e4a78a6d6e2ca38499acc706624c261db6e93cc401","uri":"robata-local://video/cam_06.mp4"},"width":1600}],"execution_mode":"LOCAL_DEVELOPMENT_OVERRIDE","exporter":{"canonical_config_sha256":"aaaaaaaaaaaaaaaaaaaaaaaaaaaaaaaaaaaaaaaaaaaaaaaaaaaaaaaaaaaaaaaa","export_profile_id":"test-remux","mode":"REMUX","name":"test.exporter","profile_version":"1.0","version":"0.1.0"},"mapping_profile":{"approved":false,"digest":"af83a664284573d1f3b55d6b09d6dd5be2db413c7bac7e3ad2e9a9b30f0325d8","version":"test-observed-v1"},"ready_manifest_id":null,"recording_identity":"a31cf20671b6f3d27cf9e43825a4d168759aece70e5beac84fdb2a0848db5ace","schema_version":"1.0","source_content_sha256":"87e1ad836e61c9b0ae4da002550e8ed5ae1605fafbd541abb8905f1b9a7090dd","source_size_bytes":13}